{
  "format": "EndfieldRegionMapRuntimeManifest/1",
  "resolverVersion": "endfield-sector128-v1",
  "coordinateConvention": {
    "bounds": "half-open [min,max)",
    "world": "Unity X/Z; +Z is north/up in every map",
    "image": "origin at top-left; +pixelX east/+X; +pixelY south/-Z",
    "streamingSector": "sectorX=floor(worldX/128), sectorZ=floor(worldZ/128)",
    "blender": "(X,Y,Z)=(Unity X,-Unity Z,Unity Y)",
    "hTile": "one 600x600 H tile equals one 128x128m streaming sector"
  },
  "maps": {
    "map01": {
      "mapId": "map01",
      "domainId": "domain_1",
      "worldBounds": {
        "xmin": -1024,
        "xmax": 1024,
        "zmin": -1024,
        "zmax": 1024
      },
      "sideSectors": 16,
      "sectorSizeMetres": 128,
      "ownershipGridOrder": "rows south-to-north; columns west-to-east",
      "ownershipGrid": [
        [
          null,
          null,
          null,
          null,
          null,
          null,
          null,
          null,
          null,
          null,
          "map01_lv003",
          null,
          null,
          null,
          null,
          null
        ],
        [
          null,
          null,
          null,
          null,
          null,
          null,
          null,
          null,
          null,
          "map01_lv003",
          "map01_lv003",
          "map01_lv003",
          null,
          null,
          null,
          null
        ],
        [
          null,
          null,
          null,
          "map01_lv001",
          "map01_lv001",
          "map01_lv001",
          "map01_lv001",
          "map01_lv001",
          "map01_lv001",
          "map01_lv003",
          "map01_lv003",
          "map01_lv003",
          null,
          null,
          null,
          null
        ],
        [
          null,
          null,
          null,
          "map01_lv001",
          "map01_lv001",
          "map01_lv001",
          "map01_lv001",
          "map01_lv001",
          "map01_lv001",
          "map01_lv003",
          "map01_lv003",
          "map01_lv003",
          null,
          null,
          null,
          null
        ],
        [
          null,
          null,
          "map01_lv001",
          "map01_lv001",
          "map01_lv001",
          "map01_lv001",
          "map01_lv001",
          "map01_lv001",
          "map01_lv001",
          "map01_lv001",
          "map01_lv005",
          "map01_lv005",
          "map01_lv005",
          "map01_lv005",
          "map01_lv005",
          null
        ],
        [
          null,
          null,
          "map01_lv001",
          "map01_lv001",
          "map01_lv001",
          "map01_lv001",
          "map01_lv001",
          "map01_lv001",
          "map01_lv001",
          "map01_lv001",
          "map01_lv005",
          "map01_lv005",
          "map01_lv005",
          "map01_lv005",
          "map01_lv005",
          null
        ],
        [
          null,
          null,
          "map01_lv001",
          "map01_lv001",
          "map01_lv001",
          "map01_lv001",
          "map01_lv001",
          "map01_lv001",
          "map01_lv001",
          "map01_lv001",
          "map01_lv005",
          "map01_lv005",
          "map01_lv005",
          "map01_lv005",
          "map01_lv005",
          null
        ],
        [
          "map01_lv002",
          "map01_lv002",
          "map01_lv002",
          "map01_lv001",
          "map01_lv001",
          "map01_lv001",
          "map01_lv001",
          "map01_lv001",
          "map01_lv001",
          "map01_lv001",
          "map01_lv005",
          "map01_lv005",
          "map01_lv005",
          "map01_lv005",
          "map01_lv005",
          null
        ],
        [
          "map01_lv002",
          "map01_lv002",
          "map01_lv002",
          "map01_lv002",
          null,
          null,
          null,
          null,
          null,
          null,
          "map01_lv006",
          "map01_lv006",
          "map01_lv006",
          "map01_lv006",
          null,
          null
        ],
        [
          "map01_lv002",
          "map01_lv002",
          "map01_lv002",
          "map01_lv002",
          null,
          null,
          "map01_lv007",
          "map01_lv007",
          "map01_lv007",
          "map01_lv007",
          "map01_lv006",
          "map01_lv006",
          "map01_lv006",
          "map01_lv006",
          "map01_lv006",
          null
        ],
        [
          "map01_lv002",
          "map01_lv002",
          "map01_lv002",
          "map01_lv002",
          null,
          null,
          "map01_lv007",
          "map01_lv007",
          "map01_lv007",
          "map01_lv007",
          "map01_lv006",
          "map01_lv006",
          "map01_lv006",
          "map01_lv006",
          "map01_lv006",
          null
        ],
        [
          null,
          null,
          null,
          null,
          "map01_lv007",
          "map01_lv007",
          "map01_lv007",
          "map01_lv007",
          "map01_lv007",
          "map01_lv007",
          "map01_lv006",
          "map01_lv006",
          "map01_lv006",
          "map01_lv006",
          null,
          null
        ],
        [
          null,
          null,
          null,
          null,
          "map01_lv007",
          "map01_lv007",
          "map01_lv007",
          "map01_lv007",
          "map01_lv007",
          "map01_lv006",
          "map01_lv006",
          "map01_lv006",
          "map01_lv006",
          "map01_lv006",
          null,
          null
        ],
        [
          null,
          null,
          null,
          null,
          "map01_lv007",
          "map01_lv007",
          "map01_lv007",
          "map01_lv007",
          "map01_lv007",
          "map01_lv006",
          "map01_lv006",
          "map01_lv006",
          "map01_lv006",
          null,
          null,
          null
        ],
        [
          null,
          null,
          null,
          null,
          null,
          null,
          null,
          null,
          null,
          null,
          null,
          null,
          null,
          null,
          null,
          null
        ],
        [
          null,
          null,
          null,
          null,
          null,
          null,
          null,
          null,
          null,
          null,
          null,
          null,
          null,
          null,
          null,
          null
        ]
      ],
      "levels": [
        {
          "levelId": "map01_lv001",
          "idNum": 21,
          "worldRect": {
            "xmin": -896,
            "xmax": 384,
            "zmin": -768,
            "zmax": 256
          },
          "hTileGrid": {
            "x": 10,
            "z": 8
          },
          "ownershipSectorCount": 43,
          "hComposition": {
            "sha256": "E4474C6B5E48EFC69C6A37825E9896E6A8F953565EDEDE19283234E56C48BD3E",
            "pixelWidth": 6000,
            "pixelHeight": 4800
          }
        },
        {
          "levelId": "map01_lv002",
          "idNum": 2,
          "worldRect": {
            "xmin": -1024,
            "xmax": -384,
            "zmin": -256,
            "zmax": 384
          },
          "hTileGrid": {
            "x": 5,
            "z": 5
          },
          "ownershipSectorCount": 15,
          "hComposition": {
            "sha256": "43422487C58BFE0F930457D6A02FA28A24F8C81A6399F21E076F8697C3F4C491",
            "pixelWidth": 3000,
            "pixelHeight": 3000
          }
        },
        {
          "levelId": "map01_lv003",
          "idNum": 3,
          "worldRect": {
            "xmin": 0,
            "xmax": 640,
            "zmin": -1024,
            "zmax": -384
          },
          "hTileGrid": {
            "x": 5,
            "z": 5
          },
          "ownershipSectorCount": 10,
          "hComposition": {
            "sha256": "989C4AE271225A42B9419D8D739A1AB41C496ED85BDD3B1382ED670B0B75F04F",
            "pixelWidth": 3000,
            "pixelHeight": 3000
          }
        },
        {
          "levelId": "map01_lv005",
          "idNum": 34,
          "worldRect": {
            "xmin": 128,
            "xmax": 1024,
            "zmin": -640,
            "zmax": 128
          },
          "hTileGrid": {
            "x": 7,
            "z": 6
          },
          "ownershipSectorCount": 20,
          "hComposition": {
            "sha256": "D9C0ABA9917D18A6628AEF6465B21EEFE9F32D98439D85FE96820CD5B9C77068",
            "pixelWidth": 4200,
            "pixelHeight": 3600
          }
        },
        {
          "levelId": "map01_lv006",
          "idNum": 35,
          "worldRect": {
            "xmin": 0,
            "xmax": 896,
            "zmin": -128,
            "zmax": 896
          },
          "hTileGrid": {
            "x": 7,
            "z": 8
          },
          "ownershipSectorCount": 27,
          "hComposition": {
            "sha256": "212DAB418B4E337B7D348312B0B4E222E09A7A367BEF9AD61BF002036785C4E5",
            "pixelWidth": 4200,
            "pixelHeight": 4800
          }
        },
        {
          "levelId": "map01_lv007",
          "idNum": 28,
          "worldRect": {
            "xmin": -640,
            "xmax": 384,
            "zmin": -128,
            "zmax": 896
          },
          "hTileGrid": {
            "x": 8,
            "z": 8
          },
          "ownershipSectorCount": 24,
          "hComposition": {
            "sha256": "41832900E7740FAC965E97DBF7586B48553D57C5E9CDE6467872C59874EBF085",
            "pixelWidth": 4800,
            "pixelHeight": 4800
          }
        }
      ],
      "overview": {
        "imageOrientation": "+Z north/up; -X west/left",
        "assetPolicy": "serve from local runtime endpoint; do not bundle game-derived PNGs in releases",
        "clean": {
          "apiUrl": "/api/v2/maps/map01/overview?variant=clean",